{
  "schemaVersion": 1,
  "libraries": ["D:\\VideoLibrary"],
  "autoStart": true,
  "autoIndexNewFiles": true,
  "intervalSeconds": 4.0,
  "batchSize": 0,
  "decoderWorkers": 0,
  "resourcePolicy": "adaptive-full",
  "filename": true,
  "visual": true,
  "speech": false,
  "ocr": false,
  "speechModel": "whisper-medium",
  "automaticUpdates": true,
  "skippedVersion": null,
  "phoneticExpansion": "medium",
  "searchModelIdleMinutes": 10
}
